{
  "$schema": "http://json-schema.org/draft-07/schema#",
  "title": "nps-kit agents config",
  "type": "object",
  "required": ["issuer_domain", "issuer_agent_id"],
  "properties": {
    "issuer_domain": {"type": "string", "minLength": 1},
    "issuer_agent_id": {"type": "string", "minLength": 1},
    "default_capabilities": {"type": "array", "items": {"type": "string"}},
    "default_budget_npt": {"type": "integer", "minimum": 1},
    "category_budget_npt": {
      "type": "object",
      "patternProperties": {
        "^\\$": {"type": "string"}
      },
      "additionalProperties": {"type": "integer", "minimum": 1}
    },
    "default_model": {"type": "string"},
    "runtime": {"type": "string", "enum": ["claude", "kiro"]},
    "default_time_limit_s": {"type": "integer", "minimum": 1},
    "default_max_turns": {"type": "integer", "minimum": 1},
    "default_shutdown_grace_s": {"type": "integer", "minimum": 1},
    "default_soft_cap_ratio": {"type": "number", "exclusiveMinimum": 0, "maximum": 1.0},
    "npt_exchange_rates": {
      "type": "object",
      "patternProperties": {
        "^\\$": {"type": "string"}
      },
      "additionalProperties": {"type": "number", "minimum": 0}
    },
    "decomposer_cmd": {"type": "string", "minLength": 1},
    "decomposer_timeout_ms": {"type": "integer", "minimum": 1},
    "merge_hold_enforce": {"type": "boolean"},
    "persona_set": {"type": "string", "minLength": 1}
  }
}
