{
  "issuer_domain": "test.localhost",
  "issuer_agent_id": "test-operator",
  "default_capabilities": ["nop:execute"],
  "default_budget_npt": 40000,
  "category_budget_npt": {
    "code":     40000,
    "docs":     60000,
    "test":     30000,
    "research": 60000,
    "refactor": 60000,
    "ops":      40000
  },
  "default_model": "sonnet",
  "default_time_limit_s": 900,
  "default_max_turns": 100,
  "default_shutdown_grace_s": 15,
  "default_soft_cap_ratio": 0.90,
  "npt_exchange_rates": {
    "claude": 1.05,
    "gpt":    1.0,
    "gemini": 0.95,
    "llama":  1.02,
    "mistral": 0.98,
    "unknown": 1.0
  }
}
